{
  "schema_version": "1.0",
  "engagement": {
    "id": "ENG-replace-me",
    "namespace": "client/brand/market/engagement",
    "decision": "unknown: decision not yet framed",
    "decision_maker": "unknown: not yet identified",
    "audience": "unknown: not yet identified",
    "client": "unknown: not yet identified",
    "brand": "unknown: not yet identified",
    "category": "unknown: not yet identified",
    "market": "unknown: not yet identified",
    "horizon": "annual",
    "outcome": "unknown: not yet framed",
    "success_metric": "unknown: not yet defined",
    "baseline": "unknown: not yet established",
    "constraints": [],
    "scope": "unknown: not yet defined",
    "mode": "diagnose",
    "depth": "standard",
    "unresolved_questions": [],
    "persistence": "proposed_update_only",
    "created": "YYYY-MM-DD"
  },
  "sources": [],
  "claims": [],
  "hypotheses": [],
  "insights": [],
  "options": [],
  "actions": [],
  "metrics": [],
  "learnings": [],
  "defects": [],
  "gate_results": [],
  "changes": []
}